{
  "$schema": "https://json-schema.org/draft/2020-12/schema",
  "$id": "urn:decluster:schema:bundle-manifest:v1",
  "type": "object",
  "additionalProperties": false,
  "required": ["schema_version", "id", "capabilities", "runs", "blobs", "limitations"],
  "properties": {
    "schema_version": {"const": 1},
    "id": {"type": "string", "minLength": 1},
    "capabilities": {
      "type": "array", "minItems": 1, "uniqueItems": true,
      "items": {"enum": ["verify_outputs", "reproduce_runs"]}
    },
    "runs": {
      "type": "array", "minItems": 1, "uniqueItems": true,
      "items": {"type": "string", "minLength": 1}
    },
    "blobs": {
      "type": "array", "minItems": 1,
      "items": {
        "type": "object", "additionalProperties": false,
        "required": ["name", "role", "bytes", "sha256", "locations"],
        "properties": {
          "name": {"type": "string", "minLength": 1},
          "role": {"enum": ["run_manifest", "dataset", "result", "source", "dependency", "lockfile", "environment"]},
          "bytes": {"type": "integer", "minimum": 0},
          "sha256": {"type": "string", "pattern": "^[0-9a-f]{64}$"},
          "locations": {
            "type": "object", "additionalProperties": false,
            "required": ["canonical", "mirrors"],
            "properties": {
              "canonical": {"type": ["string", "null"], "pattern": "^https://"},
              "mirrors": {"type": "array", "uniqueItems": true, "items": {"type": "string", "pattern": "^https://"}}
            }
          }
        }
      }
    },
    "limitations": {"type": "array", "items": {"type": "string", "minLength": 1}}
  }
}
