{
  "schema_version": 1,
  "id": "exact-oracle-evidence-v1",
  "capabilities": [
    "verify_outputs",
    "reproduce_runs"
  ],
  "runs": [
    "exact-oracle-audit-v1"
  ],
  "blobs": [
    {
      "name": "catalog/runs/exact-oracle-audit-v1.json",
      "role": "run_manifest",
      "bytes": 2735,
      "sha256": "323a581648a9bd679c024239295393acd9e0f05d79c346123572323c9526d7da",
      "locations": {
        "canonical": null,
        "mirrors": []
      }
    },
    {
      "name": "results/artifacts/exact-oracle-audit-v1.json",
      "role": "result",
      "bytes": 16593,
      "sha256": "d67458f47340ebcb346ab7cee4607925e3ebd2974c1d18fa5c13610d828bd32a",
      "locations": {
        "canonical": null,
        "mirrors": []
      }
    },
    {
      "name": "results/generated/exact-oracle-audit-v1.md",
      "role": "result",
      "bytes": 497,
      "sha256": "1d30a84ceb9c42b7247bd1317fa568999531fe1aa3708d34452264ffe32f0607",
      "locations": {
        "canonical": null,
        "mirrors": []
      }
    },
    {
      "name": "sources/decluster-eae109f-runtime.tar",
      "role": "source",
      "bytes": 2201600,
      "sha256": "9beb058c8ce5dbce15ed7b18c0eec23b3697f40f76ea5e8137ae886beea51dec",
      "locations": {
        "canonical": null,
        "mirrors": []
      }
    },
    {
      "name": "dependencies/dss-0.1.0-cp313-cp313-macosx_11_0_arm64.whl",
      "role": "dependency",
      "bytes": 337056,
      "sha256": "6890f73dd03ddc37382a0039fdce01f585c910277daf451bb29160c5bc47f2de",
      "locations": {
        "canonical": null,
        "mirrors": []
      }
    },
    {
      "name": "reproduction/exact-oracle/requirements.lock",
      "role": "lockfile",
      "bytes": 90,
      "sha256": "2a9fcd78f7c608fc9f27251c2d8d0190404961b2340514c8a3acae599342932a",
      "locations": {
        "canonical": null,
        "mirrors": []
      }
    },
    {
      "name": "reproduction/exact-oracle/environment.json",
      "role": "environment",
      "bytes": 347,
      "sha256": "2fd8820fcdc4e28164c072166be767d1d6bd0ac389dcce13ff9d2751ff4730ab",
      "locations": {
        "canonical": null,
        "mirrors": []
      }
    }
  ],
  "limitations": [
    "The bundled environment currently targets CPython 3.13 on macOS arm64.",
    "Public bootstrap remains unavailable until every blob has a canonical HTTPS location and an independent mirror."
  ]
}
