{
  "schema_version": 1,
  "id": "ns-bitcoin-v1",
  "capabilities": [
    "verify_outputs",
    "reproduce_runs"
  ],
  "runs": [
    "ns-bitcoin-v1"
  ],
  "blobs": [
    {
      "name": "catalog/runs/ns-bitcoin-v1.json",
      "role": "run_manifest",
      "bytes": 3351,
      "sha256": "9488b2af4c14230b3ded135f778fdaca270cfb91843e74d15a32991db09414ea",
      "locations": {
        "canonical": null,
        "mirrors": []
      }
    },
    {
      "name": "data/ns-bitcoin-2016-v1/left-391992-392111.ndjson.gz",
      "role": "dataset",
      "bytes": 23234649,
      "sha256": "069d207b44dcbbeaec0fae98262a3fcb76b3fe834834609e67fe883e229f26d3",
      "locations": {
        "canonical": null,
        "mirrors": []
      }
    },
    {
      "name": "data/ns-bitcoin-2016-v1/right-392112-392231.ndjson.gz",
      "role": "dataset",
      "bytes": 26043862,
      "sha256": "1d46dcccb51cd8f1a1d89481db4df45599caaaf8569f9e8e2de37e81e0e5d122",
      "locations": {
        "canonical": null,
        "mirrors": []
      }
    },
    {
      "name": "results/artifacts/ns-bitcoin-v1.json",
      "role": "result",
      "bytes": 6912,
      "sha256": "39bb12560c4c96749910324b85097938a7efe57e45ce380127bc7783c978f182",
      "locations": {
        "canonical": null,
        "mirrors": []
      }
    },
    {
      "name": "results/generated/ns-bitcoin-v1.md",
      "role": "result",
      "bytes": 416,
      "sha256": "ce6ae206e95d2be86e8ea13a9161a26a0a6566787abf396a5eeffbb23efa3fcb",
      "locations": {
        "canonical": null,
        "mirrors": []
      }
    },
    {
      "name": "sources/decluster-bcd9a3e-runtime.tar",
      "role": "source",
      "bytes": 2447360,
      "sha256": "d586f8c571b001c9bc1536f6d3eecc861bfa91a5dd55a74643eca519b4c3027b",
      "locations": {
        "canonical": null,
        "mirrors": []
      }
    },
    {
      "name": "reproduction/ns-bitcoin/requirements.lock",
      "role": "lockfile",
      "bytes": 30,
      "sha256": "e0d6a8cada5d383c0aca2bd2a37f28c15721392469c94084128d369c29c5544d",
      "locations": {
        "canonical": null,
        "mirrors": []
      }
    },
    {
      "name": "reproduction/ns-bitcoin/environment.json",
      "role": "environment",
      "bytes": 356,
      "sha256": "c67e75c5167951c159e3521acc977d4c57234fb3a9bad1a5892a51f111d1dcd6",
      "locations": {
        "canonical": null,
        "mirrors": []
      }
    }
  ],
  "limitations": [
    "The bundled environment currently targets CPython 3.13 on macOS arm64.",
    "Public bootstrap remains unavailable until every blob has a canonical HTTPS location and an independent mirror."
  ]
}
