{
  "schema_version": 1,
  "id": "deterministic-partition-v1",
  "capabilities": [
    "verify_outputs",
    "reproduce_runs"
  ],
  "runs": [
    "deterministic-partition-v1"
  ],
  "blobs": [
    {
      "name": "catalog/runs/deterministic-partition-v1.json",
      "role": "run_manifest",
      "bytes": 2943,
      "sha256": "c9caf01329d51e038b19a0b6dd67b30c7522991537636646236b37c702fee907",
      "locations": {
        "canonical": null,
        "mirrors": []
      }
    },
    {
      "name": "results/artifacts/deterministic-partition-v1.json",
      "role": "result",
      "bytes": 868,
      "sha256": "9ef88ed2230876552f3f18ebf4e1bf462e7bd401160a5d287de443abc03f7415",
      "locations": {
        "canonical": null,
        "mirrors": []
      }
    },
    {
      "name": "results/generated/deterministic-partition-v1.md",
      "role": "result",
      "bytes": 599,
      "sha256": "bcd7c6a58c1206d78841bceba862f9b9eabd9b978040bcf717a5967f0355df29",
      "locations": {
        "canonical": null,
        "mirrors": []
      }
    },
    {
      "name": "sources/decluster-cffa7d6-runtime.tar",
      "role": "source",
      "bytes": 2252800,
      "sha256": "31794e81ae86949185bf69e8e90cb44458552b8a006346665183a1c2975c91b7",
      "locations": {
        "canonical": null,
        "mirrors": []
      }
    },
    {
      "name": "reproduction/deterministic-partition/requirements.lock",
      "role": "lockfile",
      "bytes": 30,
      "sha256": "e0d6a8cada5d383c0aca2bd2a37f28c15721392469c94084128d369c29c5544d",
      "locations": {
        "canonical": null,
        "mirrors": []
      }
    },
    {
      "name": "reproduction/deterministic-partition/environment.json",
      "role": "environment",
      "bytes": 382,
      "sha256": "3611df59068f2f6fbf2a9247f3fd1102107ebc5e7c32a2531a32e9c6431d5dac",
      "locations": {
        "canonical": null,
        "mirrors": []
      }
    }
  ],
  "limitations": [
    "The bundled environment currently targets CPython 3.13 on macOS arm64.",
    "Public bootstrap remains unavailable until every blob has a canonical HTTPS location and an independent mirror."
  ]
}
