{
  "schema_version": 1,
  "id": "subtx-demix-v1",
  "capabilities": [
    "verify_outputs",
    "reproduce_runs"
  ],
  "runs": [
    "subtx-demix-v1"
  ],
  "blobs": [
    {
      "name": "catalog/runs/subtx-demix-v1.json",
      "role": "run_manifest",
      "bytes": 2679,
      "sha256": "646743499d602c488190093e6ee6e5ee8f23d61ec4e64f3e7e5cdbd3608b5708",
      "locations": {
        "canonical": null,
        "mirrors": []
      }
    },
    {
      "name": "data/subtx-demix-cache-2026-09-04.tar.gz",
      "role": "dataset",
      "bytes": 114994,
      "sha256": "191c8c2f082ac84af71b28a70169207d785243a276cf5b6e472ae6f5588a65a6",
      "locations": {
        "canonical": null,
        "mirrors": []
      }
    },
    {
      "name": "results/artifacts/subtx-demix-v1.json",
      "role": "result",
      "bytes": 1140,
      "sha256": "4485f64416d0839e876f4333c8d86e1bbb4ea8ab72c68b3f067812be6983a600",
      "locations": {
        "canonical": null,
        "mirrors": []
      }
    },
    {
      "name": "results/generated/subtx-demix-v1.md",
      "role": "result",
      "bytes": 516,
      "sha256": "1def26d56c2c64f5c7e0ce9208628a6c335981811c47d219c7f92ef019096f57",
      "locations": {
        "canonical": null,
        "mirrors": []
      }
    },
    {
      "name": "sources/decluster-4e2d32b-runtime.tar",
      "role": "source",
      "bytes": 2273280,
      "sha256": "be2888570b904d3d3b26e7e22dc7a18eeef7e8a72d7561f39214f38d95005185",
      "locations": {
        "canonical": null,
        "mirrors": []
      }
    },
    {
      "name": "reproduction/subtx-demix/requirements.lock",
      "role": "lockfile",
      "bytes": 0,
      "sha256": "e3b0c44298fc1c149afbf4c8996fb92427ae41e4649b934ca495991b7852b855",
      "locations": {
        "canonical": null,
        "mirrors": []
      }
    },
    {
      "name": "reproduction/subtx-demix/environment.json",
      "role": "environment",
      "bytes": 358,
      "sha256": "d93e7d852b6d374f7cc2f35a2a55a38e906c43f25a351da254400804fb0bade6",
      "locations": {
        "canonical": null,
        "mirrors": []
      }
    }
  ],
  "limitations": [
    "The environment targets CPython 3.13 on macOS arm64.",
    "The cache is CoinJoin-adjacent and has no ordinary-transaction labels.",
    "The historical Wasabi corpus is unavailable.",
    "Public bootstrap awaits canonical HTTPS locations and independent mirrors."
  ]
}
