{
  "schema_version": 1,
  "id": "statistical-disclosure-v1",
  "capabilities": [
    "verify_outputs",
    "reproduce_runs"
  ],
  "runs": [
    "statistical-disclosure-v1"
  ],
  "blobs": [
    {
      "name": "catalog/runs/statistical-disclosure-v1.json",
      "role": "run_manifest",
      "bytes": 2671,
      "sha256": "5b4da548b7d80540e60821df8fd9b44d49db1f1b8807a532b4dd518a0614deee",
      "locations": {
        "canonical": null,
        "mirrors": []
      }
    },
    {
      "name": "results/artifacts/statistical-disclosure-v1.json",
      "role": "result",
      "bytes": 1210,
      "sha256": "1a2ac2247a71136681b765e368b88e2686b4070039efd37b0a262a8ce6e29515",
      "locations": {
        "canonical": null,
        "mirrors": []
      }
    },
    {
      "name": "results/generated/statistical-disclosure-v1.md",
      "role": "result",
      "bytes": 682,
      "sha256": "f2c946337645978c160b5ff30321be082e46576608a54aae761d3e137ffd74b7",
      "locations": {
        "canonical": null,
        "mirrors": []
      }
    },
    {
      "name": "sources/decluster-8585ef8-runtime.tar",
      "role": "source",
      "bytes": 2293760,
      "sha256": "31ffa18186c6915dcdd7b7204bde5d92cccc417417472139b451c061f96622fb",
      "locations": {
        "canonical": null,
        "mirrors": []
      }
    },
    {
      "name": "reproduction/statistical-disclosure/requirements.lock",
      "role": "lockfile",
      "bytes": 30,
      "sha256": "e0d6a8cada5d383c0aca2bd2a37f28c15721392469c94084128d369c29c5544d",
      "locations": {
        "canonical": null,
        "mirrors": []
      }
    },
    {
      "name": "reproduction/statistical-disclosure/environment.json",
      "role": "environment",
      "bytes": 380,
      "sha256": "12eab8d9915b542dff2f5d374ad258b5e32dc4eb6c881da0584c76484076bdfa",
      "locations": {
        "canonical": null,
        "mirrors": []
      }
    }
  ],
  "limitations": [
    "The bundled environment currently targets CPython 3.13 on macOS arm64.",
    "Public bootstrap remains unavailable until every blob has a canonical HTTPS location and an independent mirror."
  ]
}
