{
  "schema_version": 1,
  "id": "special-change-labels-v1",
  "capabilities": [
    "verify_outputs",
    "reproduce_runs"
  ],
  "runs": [
    "special-change-labels-v1"
  ],
  "blobs": [
    {
      "name": "catalog/runs/special-change-labels-v1.json",
      "role": "run_manifest",
      "bytes": 3188,
      "sha256": "0ecd4d50c6d6ed0a0613a8437d899ca011c972a9112c0b52f531df56ee1e1b10",
      "locations": {
        "canonical": "https://github.com/bc1cindy/decluster/raw/3b5e1762a28e4a8a7f869c41cf3785e158950a50/catalog/runs/special-change-labels-v1.json",
        "mirrors": []
      }
    },
    {
      "name": "data/fs-blkcache-2026-09-04.tar.gz",
      "role": "dataset",
      "bytes": 33352455,
      "sha256": "5a69f6f446dbdfcce09dddc91c653e5d841124d14020b720fdea276315c775a6",
      "locations": {
        "canonical": "https://github.com/bc1cindy/decluster/raw/b797864acf974e329d27d394ced7bb96cabbbfd7/data/fs-blkcache-2026-09-04.tar.gz",
        "mirrors": []
      }
    },
    {
      "name": "results/artifacts/special-change-labels-v1.json",
      "role": "result",
      "bytes": 2491,
      "sha256": "88fcdc14d41aa1f51e0e2f359d1ee6242bd69fa15ac9d9413e879970b2b5b581",
      "locations": {
        "canonical": "https://github.com/bc1cindy/decluster/raw/b797864acf974e329d27d394ced7bb96cabbbfd7/results/artifacts/special-change-labels-v1.json",
        "mirrors": []
      }
    },
    {
      "name": "results/generated/special-change-labels-v1.md",
      "role": "result",
      "bytes": 3337,
      "sha256": "568aa47aac4b0f8e26a7d2b498b3f3bef80709555fe16507169540cb53f822f5",
      "locations": {
        "canonical": "https://github.com/bc1cindy/decluster/raw/b797864acf974e329d27d394ced7bb96cabbbfd7/results/generated/special-change-labels-v1.md",
        "mirrors": []
      }
    },
    {
      "name": "sources/decluster-4844877-runtime.tar",
      "role": "source",
      "bytes": 2457600,
      "sha256": "18893f6a7cf35071c8065a531df466b391b971d690969e89a838de59ba250666",
      "locations": {
        "canonical": "https://github.com/bc1cindy/decluster/raw/3b5e1762a28e4a8a7f869c41cf3785e158950a50/sources/decluster-4844877-runtime.tar",
        "mirrors": []
      }
    },
    {
      "name": "reproduction/special-change-labels/requirements.lock",
      "role": "lockfile",
      "bytes": 30,
      "sha256": "e0d6a8cada5d383c0aca2bd2a37f28c15721392469c94084128d369c29c5544d",
      "locations": {
        "canonical": "https://github.com/bc1cindy/decluster/raw/b797864acf974e329d27d394ced7bb96cabbbfd7/reproduction/special-change-labels/requirements.lock",
        "mirrors": []
      }
    },
    {
      "name": "reproduction/special-change-labels/environment.json",
      "role": "environment",
      "bytes": 378,
      "sha256": "9f93934dfcca9ab7cdc0f97f53160471db7477bb9e2483a25d96c73c37678801",
      "locations": {
        "canonical": "https://github.com/bc1cindy/decluster/raw/3b5e1762a28e4a8a7f869c41cf3785e158950a50/reproduction/special-change-labels/environment.json",
        "mirrors": []
      }
    }
  ],
  "limitations": [
    "The bundled environment currently targets CPython 3.13 on macOS arm64.",
    "The public on-chain snapshot is redistributed with provider authorization.",
    "The multi-epoch downloads the original figures came from are unavailable and are not reproduced.",
    "Public bootstrap remains incomplete until every blob has a canonical HTTPS location and an independent mirror."
  ]
}
