{
  "schema_version": 1,
  "id": "graph-rejoin-2016-v1",
  "capabilities": [
    "verify_outputs",
    "reproduce_runs"
  ],
  "runs": [
    "graph-rejoin-2016-v1"
  ],
  "blobs": [
    {
      "name": "catalog/runs/graph-rejoin-2016-v1.json",
      "role": "run_manifest",
      "bytes": 3300,
      "sha256": "98e6cd1af3866eff28ead4b88f74b7d40cfebdaf59eab374e31a0be617c54801",
      "locations": {
        "canonical": "https://github.com/bc1cindy/decluster/raw/b797864acf974e329d27d394ced7bb96cabbbfd7/catalog/runs/graph-rejoin-2016-v1.json",
        "mirrors": []
      }
    },
    {
      "name": "data/epochs-2016-weekly-v1/391104-392111.epochgraph.xz",
      "role": "dataset",
      "bytes": 10422968,
      "sha256": "cd129cd4bb225ea7a6733dab891b20272d62d1b0f3a6caf07a4209f9f2368015",
      "locations": {
        "canonical": "https://github.com/bc1cindy/decluster/raw/b797864acf974e329d27d394ced7bb96cabbbfd7/data/epochs-2016-weekly-v1/391104-392111.epochgraph.xz",
        "mirrors": []
      }
    },
    {
      "name": "data/epochs-2016-weekly-v1/392112-393119.epochgraph.xz",
      "role": "dataset",
      "bytes": 12928408,
      "sha256": "0893000345e68249911cb8ee6467a47fa6feecd3022f27e2732bcabfb4725f11",
      "locations": {
        "canonical": "https://github.com/bc1cindy/decluster/raw/b797864acf974e329d27d394ced7bb96cabbbfd7/data/epochs-2016-weekly-v1/392112-393119.epochgraph.xz",
        "mirrors": []
      }
    },
    {
      "name": "results/artifacts/graph-rejoin-2016-v1.json",
      "role": "result",
      "bytes": 1777,
      "sha256": "ec27b8a3dc36b06482b86cdcb556038d88b73f3595c1e37d78867c5ce159841c",
      "locations": {
        "canonical": "https://github.com/bc1cindy/decluster/raw/b797864acf974e329d27d394ced7bb96cabbbfd7/results/artifacts/graph-rejoin-2016-v1.json",
        "mirrors": []
      }
    },
    {
      "name": "results/generated/graph-rejoin-2016-v1.md",
      "role": "result",
      "bytes": 2507,
      "sha256": "1d5afe106a2bb84edd7925ca4ed213d9f5bc3c35349d48dac47c6051492543ed",
      "locations": {
        "canonical": "https://github.com/bc1cindy/decluster/raw/b797864acf974e329d27d394ced7bb96cabbbfd7/results/generated/graph-rejoin-2016-v1.md",
        "mirrors": []
      }
    },
    {
      "name": "sources/decluster-59195e2-runtime.tar",
      "role": "source",
      "bytes": 2437120,
      "sha256": "8803bf1fe4950365bd5e07e582b087b2ad6bffef05bc869e294dd7e50fa6fb19",
      "locations": {
        "canonical": "https://github.com/bc1cindy/decluster/raw/b797864acf974e329d27d394ced7bb96cabbbfd7/sources/decluster-59195e2-runtime.tar",
        "mirrors": []
      }
    },
    {
      "name": "dependencies/numpy-2.5.1-cp313-cp313-macosx_14_0_arm64.whl",
      "role": "dependency",
      "bytes": 5325143,
      "sha256": "6165343f81b56ef8f514f396989e529b61d9dc709b99421b07e9f3e698e2287d",
      "locations": {
        "canonical": "https://github.com/bc1cindy/decluster/raw/b797864acf974e329d27d394ced7bb96cabbbfd7/dependencies/numpy-2.5.1-cp313-cp313-macosx_14_0_arm64.whl",
        "mirrors": []
      }
    },
    {
      "name": "reproduction/graph-rejoin-2016/requirements.lock",
      "role": "lockfile",
      "bytes": 92,
      "sha256": "efdf4055dba10bfff2541ccaf3668be030c7caed44c61650540cc106393e9636",
      "locations": {
        "canonical": "https://github.com/bc1cindy/decluster/raw/b797864acf974e329d27d394ced7bb96cabbbfd7/reproduction/graph-rejoin-2016/requirements.lock",
        "mirrors": []
      }
    },
    {
      "name": "reproduction/graph-rejoin-2016/environment.json",
      "role": "environment",
      "bytes": 352,
      "sha256": "5c5cd35dfaaf8370bb182975a1e2b2a53e3d9ba0b2ab268d3135cde4578d979f",
      "locations": {
        "canonical": "https://github.com/bc1cindy/decluster/raw/b797864acf974e329d27d394ced7bb96cabbbfd7/reproduction/graph-rejoin-2016/environment.json",
        "mirrors": []
      }
    }
  ],
  "limitations": [
    "The bundled environment currently targets CPython 3.13 on macOS arm64.",
    "The public on-chain snapshot is redistributed with provider authorization.",
    "The historical 165,832-transaction cache is unavailable and is not reproduced.",
    "Public bootstrap remains incomplete until every blob has a canonical HTTPS location and an independent mirror."
  ]
}
