{
  "schema_version": 1,
  "id": "fingerprint-sparsity-v1",
  "capabilities": [
    "verify_outputs",
    "reproduce_runs"
  ],
  "runs": [
    "fingerprint-sparsity-v1"
  ],
  "blobs": [
    {
      "name": "catalog/runs/fingerprint-sparsity-v1.json",
      "role": "run_manifest",
      "bytes": 3180,
      "sha256": "b1d0227bf13d439855cf107ac00d3c092bf4db857d22101d0739fae09f0e6def",
      "locations": {
        "canonical": null,
        "mirrors": []
      }
    },
    {
      "name": "tests/fixtures/lumen_explorer_data.json",
      "role": "dataset",
      "bytes": 432353,
      "sha256": "5337d4bdc574726a2cb4e28f329f16709b497479a7493882bd38d77875660ac9",
      "locations": {
        "canonical": "https://github.com/bc1cindy/decluster/raw/103b13efc9e32569642983d7038f365dcb0c09c6/tests/fixtures/lumen_explorer_data.json",
        "mirrors": []
      }
    },
    {
      "name": "results/artifacts/fingerprint-sparsity-v1.json",
      "role": "result",
      "bytes": 1429,
      "sha256": "923000f70f5eaaf7349a0715d3ed83c382d4b414d28c0e8aa617103871f9ec79",
      "locations": {
        "canonical": null,
        "mirrors": []
      }
    },
    {
      "name": "results/generated/fingerprint-sparsity-v1.md",
      "role": "result",
      "bytes": 694,
      "sha256": "9740d4ad0c64d229df372b81499ae33f1dd54c097a4e26a2fccbee73b80bec6d",
      "locations": {
        "canonical": null,
        "mirrors": []
      }
    },
    {
      "name": "sources/decluster-8585ef8-runtime.tar",
      "role": "source",
      "bytes": 2293760,
      "sha256": "31ffa18186c6915dcdd7b7204bde5d92cccc417417472139b451c061f96622fb",
      "locations": {
        "canonical": null,
        "mirrors": []
      }
    },
    {
      "name": "reproduction/fingerprint-sparsity/requirements.lock",
      "role": "lockfile",
      "bytes": 0,
      "sha256": "e3b0c44298fc1c149afbf4c8996fb92427ae41e4649b934ca495991b7852b855",
      "locations": {
        "canonical": null,
        "mirrors": []
      }
    },
    {
      "name": "reproduction/fingerprint-sparsity/environment.json",
      "role": "environment",
      "bytes": 376,
      "sha256": "a4baa6cfe9abd1d9ea6992cff17092574f385b0cd67aa541a3fb12ba96af4382",
      "locations": {
        "canonical": null,
        "mirrors": []
      }
    }
  ],
  "limitations": [
    "The bundled environment currently targets CPython 3.13 on macOS arm64.",
    "The dataset publisher authorized redistribution of the public aggregate on 2026-09-04; upstream licensing remains undetermined.",
    "The bundle reproduces the preserved 12-axis whole-window aggregate, not the unavailable 19-axis or per-epoch columns.",
    "Public bootstrap remains incomplete until every blob has a canonical HTTPS location and an independent mirror."
  ]
}
