{
  "schema_version": 1,
  "id": "ns-link-prediction-coverage-v2",
  "capabilities": [
    "verify_outputs",
    "reproduce_runs"
  ],
  "runs": [
    "ns-link-prediction-coverage-v2"
  ],
  "blobs": [
    {
      "name": "catalog/runs/ns-link-prediction-coverage-v2.json",
      "role": "run_manifest",
      "bytes": 2837,
      "sha256": "e5aa142399dc0ddf9ef7aef0471726058252d25b4d07903bd149e0906fd040c1",
      "locations": {
        "canonical": null,
        "mirrors": []
      }
    },
    {
      "name": "results/artifacts/ns-link-prediction-coverage-v2.json",
      "role": "result",
      "bytes": 2500,
      "sha256": "1223ce1528c4136d78fb727cc9bc81043af15d47562b7d215973a37b386fbaf4",
      "locations": {
        "canonical": null,
        "mirrors": []
      }
    },
    {
      "name": "results/generated/ns-link-prediction-coverage-v2.md",
      "role": "result",
      "bytes": 1522,
      "sha256": "009538122a9c35006d6ac47a1129317d504fd15ac6861dffaa3c115cc3edc872",
      "locations": {
        "canonical": null,
        "mirrors": []
      }
    },
    {
      "name": "sources/decluster-9fc6732-runtime.tar",
      "role": "source",
      "bytes": 2242560,
      "sha256": "19b95145aff04f38bbdfec1694da05391915538e2c8d85999ecc195e5d4058b7",
      "locations": {
        "canonical": null,
        "mirrors": []
      }
    },
    {
      "name": "reproduction/ns-link-prediction-coverage/requirements.lock",
      "role": "lockfile",
      "bytes": 30,
      "sha256": "e0d6a8cada5d383c0aca2bd2a37f28c15721392469c94084128d369c29c5544d",
      "locations": {
        "canonical": null,
        "mirrors": []
      }
    },
    {
      "name": "reproduction/ns-link-prediction-coverage/environment.json",
      "role": "environment",
      "bytes": 390,
      "sha256": "1795d1b72bf63549811985c8d370e979db77198c445dd472e6bd5a3dc0ee4b82",
      "locations": {
        "canonical": null,
        "mirrors": []
      }
    }
  ],
  "limitations": [
    "The bundled environment currently targets CPython 3.13 on macOS arm64.",
    "The coverage fixture needs no external dataset or network access.",
    "Public bootstrap remains unavailable until every blob has a canonical HTTPS location and an independent mirror."
  ]
}
