{
  "schema_version": 1,
  "id": "cioh-collaborative-false-merge-v1",
  "capabilities": [
    "verify_outputs",
    "reproduce_runs"
  ],
  "runs": [
    "cioh-collaborative-false-merge-v1"
  ],
  "blobs": [
    {
      "name": "catalog/runs/cioh-collaborative-false-merge-v1.json",
      "role": "run_manifest",
      "bytes": 2565,
      "sha256": "fd4a2b9c1b50dac0be1a058099d80ff4c3dedc2af743c84f748b8992a6fbf7c2",
      "locations": {
        "canonical": null,
        "mirrors": []
      }
    },
    {
      "name": "results/artifacts/cioh-collaborative-false-merge-v1.json",
      "role": "result",
      "bytes": 583,
      "sha256": "0962e258838b34a41978866d73a3a867968271cf8a2e7827db503f341adff78b",
      "locations": {
        "canonical": null,
        "mirrors": []
      }
    },
    {
      "name": "results/generated/cioh-collaborative-false-merge-v1.md",
      "role": "result",
      "bytes": 550,
      "sha256": "556b2c5c9355032d65b0939613b33d01d0aa3daa2d89c3b3143d8110ba6b2a8a",
      "locations": {
        "canonical": null,
        "mirrors": []
      }
    },
    {
      "name": "sources/decluster-be1c6bf-runtime.tar",
      "role": "source",
      "bytes": 2283520,
      "sha256": "ef4d317deac7fac661dfdcaae937c706d86661d8cc35af12d830f3dc7eb8a9b9",
      "locations": {
        "canonical": null,
        "mirrors": []
      }
    },
    {
      "name": "reproduction/cioh-collaborative/requirements.lock",
      "role": "lockfile",
      "bytes": 30,
      "sha256": "e0d6a8cada5d383c0aca2bd2a37f28c15721392469c94084128d369c29c5544d",
      "locations": {
        "canonical": null,
        "mirrors": []
      }
    },
    {
      "name": "reproduction/cioh-collaborative/environment.json",
      "role": "environment",
      "bytes": 372,
      "sha256": "5130ecafae925f152dc835469f77b2df4ac0e553baa3f21cc69182b1ffb993ec",
      "locations": {
        "canonical": null,
        "mirrors": []
      }
    }
  ],
  "limitations": [
    "The bundled environment currently targets CPython 3.13 on macOS arm64.",
    "Public bootstrap remains unavailable until every blob has a canonical HTTPS location and an independent mirror."
  ]
}
