{
  "schema_version": 1,
  "id": "denomination-preparation-v1",
  "capabilities": [
    "verify_outputs",
    "reproduce_runs"
  ],
  "runs": [
    "denomination-preparation-v1"
  ],
  "blobs": [
    {
      "name": "catalog/runs/denomination-preparation-v1.json",
      "role": "run_manifest",
      "bytes": 2664,
      "sha256": "bbcaacb990b6a9aef5005f66421335279cb720fca74958c8ee758f06997aefb5",
      "locations": {
        "canonical": null,
        "mirrors": []
      }
    },
    {
      "name": "results/artifacts/denomination-preparation-v1.json",
      "role": "result",
      "bytes": 1299,
      "sha256": "6102106a1ac39bdfb1f668a7c90772f01c29c214a1fb2a76088403165dbe4ce2",
      "locations": {
        "canonical": null,
        "mirrors": []
      }
    },
    {
      "name": "results/generated/denomination-preparation-v1.md",
      "role": "result",
      "bytes": 546,
      "sha256": "c433cfc5c966ba7af33ea595cad134862726168033c2029d8b11574319cf0fc8",
      "locations": {
        "canonical": null,
        "mirrors": []
      }
    },
    {
      "name": "sources/decluster-002a6be-runtime.tar",
      "role": "source",
      "bytes": 2293760,
      "sha256": "83fc851ee67d554f5515747a00e07bbdc7a35d411160c99cb30a84c4df484b65",
      "locations": {
        "canonical": null,
        "mirrors": []
      }
    },
    {
      "name": "reproduction/denomination-preparation/requirements.lock",
      "role": "lockfile",
      "bytes": 30,
      "sha256": "e0d6a8cada5d383c0aca2bd2a37f28c15721392469c94084128d369c29c5544d",
      "locations": {
        "canonical": null,
        "mirrors": []
      }
    },
    {
      "name": "reproduction/denomination-preparation/environment.json",
      "role": "environment",
      "bytes": 384,
      "sha256": "ca61ae6a5a8bd560dcd93753f406c19b96e3f59c337252bc116a144a1f9813f7",
      "locations": {
        "canonical": null,
        "mirrors": []
      }
    }
  ],
  "limitations": [
    "The bundled environment currently targets CPython 3.13 on macOS arm64.",
    "Public bootstrap remains unavailable until every blob has a canonical HTTPS location and an independent mirror."
  ]
}
