{
  "schema_version": 1,
  "id": "boltzmann-fee-audit-v1",
  "capabilities": [
    "verify_outputs",
    "reproduce_runs"
  ],
  "runs": [
    "boltzmann-fee-audit-v1"
  ],
  "blobs": [
    {
      "name": "catalog/runs/boltzmann-fee-audit-v1.json",
      "role": "run_manifest",
      "bytes": 2990,
      "sha256": "0d3168d7ff979de9dad535fbbd0461d61536763d2eb5521383146f080f799d5e",
      "locations": {
        "canonical": null,
        "mirrors": []
      }
    },
    {
      "name": "data/boltzmann-fee-audit-v1.json",
      "role": "dataset",
      "bytes": 309025,
      "sha256": "17ee62e307d34660be2c4f50382a63ba044d0ad67f0674873e304d0b8203dc1c",
      "locations": {
        "canonical": null,
        "mirrors": []
      }
    },
    {
      "name": "results/artifacts/boltzmann-fee-audit-v1.json",
      "role": "result",
      "bytes": 52813,
      "sha256": "9cf09b7659cf0f8f3e429623a903708c450a2c1605035cc4f45f6e1dcb34d2b3",
      "locations": {
        "canonical": null,
        "mirrors": []
      }
    },
    {
      "name": "results/generated/boltzmann-fee-audit-v1.md",
      "role": "result",
      "bytes": 523,
      "sha256": "f4e6c0afd79425e8259d4112190a5df3b3eee81344cd7023f786c4671264e112",
      "locations": {
        "canonical": null,
        "mirrors": []
      }
    },
    {
      "name": "sources/decluster-9fc6732-runtime.tar",
      "role": "source",
      "bytes": 2242560,
      "sha256": "19b95145aff04f38bbdfec1694da05391915538e2c8d85999ecc195e5d4058b7",
      "locations": {
        "canonical": null,
        "mirrors": []
      }
    },
    {
      "name": "reproduction/boltzmann-fee-audit/requirements.lock",
      "role": "lockfile",
      "bytes": 30,
      "sha256": "e0d6a8cada5d383c0aca2bd2a37f28c15721392469c94084128d369c29c5544d",
      "locations": {
        "canonical": null,
        "mirrors": []
      }
    },
    {
      "name": "reproduction/boltzmann-fee-audit/environment.json",
      "role": "environment",
      "bytes": 374,
      "sha256": "efd402990f9e7d1c43c855fdbcad546c7a7d6a080df2899d3900d5601a08dfcd",
      "locations": {
        "canonical": null,
        "mirrors": []
      }
    }
  ],
  "limitations": [
    "The bundled environment currently targets CPython 3.13 on macOS arm64.",
    "Public bootstrap remains unavailable until every blob has a canonical HTTPS location and an independent mirror."
  ]
}
