{
  "schema_version": 1,
  "id": "amount-subset-sum-v1",
  "capabilities": [
    "verify_outputs",
    "reproduce_runs"
  ],
  "runs": [
    "amount-subset-sum-v1"
  ],
  "blobs": [
    {
      "name": "catalog/runs/amount-subset-sum-v1.json",
      "role": "run_manifest",
      "bytes": 3205,
      "sha256": "ca7aba01b4fe8acf9591c38d234508f6d9f787f9966cbdb5b8538fd0c5acd470",
      "locations": {
        "canonical": null,
        "mirrors": []
      }
    },
    {
      "name": "data/amount-channel-812695-812831-v1.json",
      "role": "dataset",
      "bytes": 8028513,
      "sha256": "83b4391f78d07a2fa85a67218d5ae4420d8965da3c95af577592e9ec1850104d",
      "locations": {
        "canonical": null,
        "mirrors": []
      }
    },
    {
      "name": "results/artifacts/amount-subset-sum-v1.json",
      "role": "result",
      "bytes": 666,
      "sha256": "240592b5af814fbcd28b06221805b934424170119da5e62e9da0281944377a9d",
      "locations": {
        "canonical": null,
        "mirrors": []
      }
    },
    {
      "name": "results/generated/amount-subset-sum-v1.md",
      "role": "result",
      "bytes": 385,
      "sha256": "3caca166d157fb1a1b7b8c995d126bf47ff653a6b7eb01b416b1cef7e254e02f",
      "locations": {
        "canonical": null,
        "mirrors": []
      }
    },
    {
      "name": "sources/decluster-882af96-runtime.tar",
      "role": "source",
      "bytes": 2088960,
      "sha256": "e36aad3fafad30ad7771226ba679572f423dc382b56cd95bb9b915a947f376d3",
      "locations": {
        "canonical": null,
        "mirrors": []
      }
    },
    {
      "name": "dependencies/dss-0.1.0-cp313-cp313-macosx_11_0_arm64.whl",
      "role": "dependency",
      "bytes": 337056,
      "sha256": "6890f73dd03ddc37382a0039fdce01f585c910277daf451bb29160c5bc47f2de",
      "locations": {
        "canonical": null,
        "mirrors": []
      }
    },
    {
      "name": "reproduction/amount-subset-sum/requirements.lock",
      "role": "lockfile",
      "bytes": 90,
      "sha256": "2a9fcd78f7c608fc9f27251c2d8d0190404961b2340514c8a3acae599342932a",
      "locations": {
        "canonical": null,
        "mirrors": []
      }
    },
    {
      "name": "reproduction/amount-subset-sum/environment.json",
      "role": "environment",
      "bytes": 352,
      "sha256": "b90473728cfc4b1318f7bbb6f7965e76112821dc89096597b1d89db06410d058",
      "locations": {
        "canonical": null,
        "mirrors": []
      }
    }
  ],
  "limitations": [
    "The bundled environment currently targets CPython 3.13 on macOS arm64.",
    "Public bootstrap remains unavailable until every blob has a canonical HTTPS location and an independent mirror."
  ]
}
