{
  "schema_version": 1,
  "id": "library-calibration-v1",
  "capabilities": [
    "verify_outputs",
    "reproduce_runs"
  ],
  "runs": [
    "library-calibration-v1"
  ],
  "blobs": [
    {
      "name": "catalog/runs/library-calibration-v1.json",
      "role": "run_manifest",
      "bytes": 3011,
      "sha256": "ca97b827acfaa55cfa7daf086defdf81f1558d86f93ac18c58120412e6ced493",
      "locations": {
        "canonical": null,
        "mirrors": []
      }
    },
    {
      "name": "data/fs-blkcache-2026-09-04.tar.gz",
      "role": "dataset",
      "bytes": 33352455,
      "sha256": "5a69f6f446dbdfcce09dddc91c653e5d841124d14020b720fdea276315c775a6",
      "locations": {
        "canonical": null,
        "mirrors": []
      }
    },
    {
      "name": "results/artifacts/library-calibration-v1.json",
      "role": "result",
      "bytes": 17737,
      "sha256": "5c807a848e9a04cd41065e096af472df0ea568a88792bdd9027bbad58c9064c5",
      "locations": {
        "canonical": null,
        "mirrors": []
      }
    },
    {
      "name": "results/generated/library-calibration-v1.md",
      "role": "result",
      "bytes": 2173,
      "sha256": "949d2d9e890818c5ec890484b13750ed6855e6538c9a45c3c5c4b3daf2454a5b",
      "locations": {
        "canonical": null,
        "mirrors": []
      }
    },
    {
      "name": "sources/decluster-1926e7c-runtime.tar",
      "role": "source",
      "bytes": 2293760,
      "sha256": "3c5d96ed5583c1f3623ce6c4b86dbb7374330dcefdbb702432e5a4db3f64815f",
      "locations": {
        "canonical": null,
        "mirrors": []
      }
    },
    {
      "name": "reproduction/library-calibration/requirements.lock",
      "role": "lockfile",
      "bytes": 30,
      "sha256": "e0d6a8cada5d383c0aca2bd2a37f28c15721392469c94084128d369c29c5544d",
      "locations": {
        "canonical": null,
        "mirrors": []
      }
    },
    {
      "name": "reproduction/library-calibration/environment.json",
      "role": "environment",
      "bytes": 374,
      "sha256": "8cb6485f8c4d3749a1f3b8f2871bec6fb7ca4fecd46660b11d21b706909ee240",
      "locations": {
        "canonical": null,
        "mirrors": []
      }
    }
  ],
  "limitations": [
    "The bundled environment currently targets CPython 3.13 on macOS arm64.",
    "The public on-chain snapshot is redistributed with provider authorization.",
    "The bundle measures the distance between the shipped calibration and the committed cache; it does not restore the population the shipped table was measured on."
  ]
}
