{
  "schema_version": 1,
  "id": "intersection-cluster-fixture-v1",
  "capabilities": [
    "verify_outputs",
    "reproduce_runs"
  ],
  "runs": [
    "intersection-cluster-fixture-v1"
  ],
  "blobs": [
    {
      "name": "catalog/runs/intersection-cluster-fixture-v1.json",
      "role": "run_manifest",
      "bytes": 2497,
      "sha256": "b824d7fb9692ceac231b4957abd57bc1cdd0f31a59c3edba8b660c486bb43c0f",
      "locations": {
        "canonical": null,
        "mirrors": []
      }
    },
    {
      "name": "results/artifacts/intersection-cluster-fixture-v1.json",
      "role": "result",
      "bytes": 1869,
      "sha256": "2114e568b91808536c94ddb307a4688e3be32720bcb768ef9bb790ef673d0fe5",
      "locations": {
        "canonical": null,
        "mirrors": []
      }
    },
    {
      "name": "results/generated/intersection-cluster-fixture-v1.md",
      "role": "result",
      "bytes": 385,
      "sha256": "3fd9f9bf57e30f4b92851852efa24e4af2201c705c39391d9451b68689005434",
      "locations": {
        "canonical": null,
        "mirrors": []
      }
    },
    {
      "name": "sources/decluster-4e2d32b-runtime.tar",
      "role": "source",
      "bytes": 2273280,
      "sha256": "be2888570b904d3d3b26e7e22dc7a18eeef7e8a72d7561f39214f38d95005185",
      "locations": {
        "canonical": null,
        "mirrors": []
      }
    },
    {
      "name": "reproduction/intersection-cluster-fixture/requirements.lock",
      "role": "lockfile",
      "bytes": 31,
      "sha256": "c7d402576511073ed4fcf076c77ffa6b3be124e0a2ef996d2da1cd3b02fbe541",
      "locations": {
        "canonical": null,
        "mirrors": []
      }
    },
    {
      "name": "reproduction/intersection-cluster-fixture/environment.json",
      "role": "environment",
      "bytes": 392,
      "sha256": "da2ecf4c0af82671105a5b619f8562823e12a5f13246ab1b33c7493bf3fcc021",
      "locations": {
        "canonical": null,
        "mirrors": []
      }
    }
  ],
  "limitations": [
    "The bundled environment currently targets CPython 3.13 on macOS arm64.",
    "Public bootstrap remains unavailable until every blob has a canonical HTTPS location and an independent mirror."
  ]
}
