{
  "schema_version": 1,
  "id": "amount-pairwise-family-v1",
  "capabilities": [
    "verify_outputs",
    "reproduce_runs"
  ],
  "runs": [
    "amount-pairwise-family-v1"
  ],
  "blobs": [
    {
      "name": "catalog/runs/amount-pairwise-family-v1.json",
      "role": "run_manifest",
      "bytes": 3592,
      "sha256": "aba8ec1faedf53ce935808effd50eae2d278a8e09208c013f993bc55e15e3eeb",
      "locations": {
        "canonical": null,
        "mirrors": []
      }
    },
    {
      "name": "data/amount-channel-812695-812831-v1.json",
      "role": "dataset",
      "bytes": 8028513,
      "sha256": "83b4391f78d07a2fa85a67218d5ae4420d8965da3c95af577592e9ec1850104d",
      "locations": {
        "canonical": null,
        "mirrors": []
      }
    },
    {
      "name": "results/artifacts/amount-pairwise-family-v1.json",
      "role": "result",
      "bytes": 1027,
      "sha256": "83f6a9e8501ee4df45f08b8c8ffc2f7265d40bf9add6d3f5093d712657c9dbf5",
      "locations": {
        "canonical": null,
        "mirrors": []
      }
    },
    {
      "name": "results/generated/amount-pairwise-family-v1.md",
      "role": "result",
      "bytes": 499,
      "sha256": "aeaabdc282b4aed6946c6054b95e8b5dd9c20e50eca467de49827e453d5353df",
      "locations": {
        "canonical": null,
        "mirrors": []
      }
    },
    {
      "name": "sources/decluster-cd93ceb-runtime.tar",
      "role": "source",
      "bytes": 2129920,
      "sha256": "a3666243c8189e1806365129538b426d091173b9cc6777214b663dc9a82a7d58",
      "locations": {
        "canonical": null,
        "mirrors": []
      }
    },
    {
      "name": "dependencies/dss-0.1.0-cp313-cp313-macosx_11_0_arm64.whl",
      "role": "dependency",
      "bytes": 337056,
      "sha256": "6890f73dd03ddc37382a0039fdce01f585c910277daf451bb29160c5bc47f2de",
      "locations": {
        "canonical": null,
        "mirrors": []
      }
    },
    {
      "name": "reproduction/amount-pairwise-family/requirements.lock",
      "role": "lockfile",
      "bytes": 90,
      "sha256": "2a9fcd78f7c608fc9f27251c2d8d0190404961b2340514c8a3acae599342932a",
      "locations": {
        "canonical": null,
        "mirrors": []
      }
    },
    {
      "name": "reproduction/amount-pairwise-family/environment.json",
      "role": "environment",
      "bytes": 357,
      "sha256": "dc0ca8168e2b60d752b0b05fcea0cdc123fed8a065f8f9ec869092bf5b7f4fb2",
      "locations": {
        "canonical": null,
        "mirrors": []
      }
    }
  ],
  "limitations": [
    "The bundled environment currently targets CPython 3.13 on macOS arm64.",
    "Wall-time outcomes are resource-dependent even in the pinned environment.",
    "Public bootstrap remains unavailable until every blob has a canonical HTTPS location and an independent mirror."
  ]
}
