{
  "schema_version": 1,
  "id": "counting-methods-v1",
  "capabilities": [
    "verify_outputs",
    "reproduce_runs"
  ],
  "runs": [
    "counting-methods-v1"
  ],
  "blobs": [
    {
      "name": "catalog/runs/counting-methods-v1.json",
      "role": "run_manifest",
      "bytes": 2644,
      "sha256": "8e55ac0dfcfed6b2c9318a81336c74b2c8ca71fe4143dd1e7198adab9b2879ba",
      "locations": {
        "canonical": "https://github.com/bc1cindy/decluster/raw/3b5e1762a28e4a8a7f869c41cf3785e158950a50/catalog/runs/counting-methods-v1.json",
        "mirrors": []
      }
    },
    {
      "name": "results/artifacts/counting-router-v1.json",
      "role": "result",
      "bytes": 897,
      "sha256": "7c0764b7f39ad8795b4e349cff0903f68b7edcbc3f0d75cc6691a138813239b7",
      "locations": {
        "canonical": "https://github.com/bc1cindy/decluster/raw/b797864acf974e329d27d394ced7bb96cabbbfd7/results/artifacts/counting-router-v1.json",
        "mirrors": []
      }
    },
    {
      "name": "results/artifacts/counting-fee-sensitivity-v1.json",
      "role": "result",
      "bytes": 1968,
      "sha256": "0fef54735522470634c696ec026c31c86dff4d4dae23da956b49d8f89eb3a508",
      "locations": {
        "canonical": "https://github.com/bc1cindy/decluster/raw/b797864acf974e329d27d394ced7bb96cabbbfd7/results/artifacts/counting-fee-sensitivity-v1.json",
        "mirrors": []
      }
    },
    {
      "name": "results/artifacts/counting-methods-v1.json",
      "role": "result",
      "bytes": 3003,
      "sha256": "81d48cf4f7b71eb62354cfd589a40fdfc6171a54b0c9b7a768bd45198e7a1312",
      "locations": {
        "canonical": "https://github.com/bc1cindy/decluster/raw/b797864acf974e329d27d394ced7bb96cabbbfd7/results/artifacts/counting-methods-v1.json",
        "mirrors": []
      }
    },
    {
      "name": "results/generated/counting-methods-v1.md",
      "role": "result",
      "bytes": 795,
      "sha256": "7783ece95b71bd11cacf9b6f350b7d22c87c54a46ca7e75b3c5dbeb62e5d091d",
      "locations": {
        "canonical": "https://github.com/bc1cindy/decluster/raw/b797864acf974e329d27d394ced7bb96cabbbfd7/results/generated/counting-methods-v1.md",
        "mirrors": []
      }
    },
    {
      "name": "sources/decluster-4844877-runtime.tar",
      "role": "source",
      "bytes": 2457600,
      "sha256": "18893f6a7cf35071c8065a531df466b391b971d690969e89a838de59ba250666",
      "locations": {
        "canonical": "https://github.com/bc1cindy/decluster/raw/3b5e1762a28e4a8a7f869c41cf3785e158950a50/sources/decluster-4844877-runtime.tar",
        "mirrors": []
      }
    },
    {
      "name": "reproduction/counting-methods/requirements.lock",
      "role": "lockfile",
      "bytes": 0,
      "sha256": "e3b0c44298fc1c149afbf4c8996fb92427ae41e4649b934ca495991b7852b855",
      "locations": {
        "canonical": "https://github.com/bc1cindy/decluster/raw/b797864acf974e329d27d394ced7bb96cabbbfd7/reproduction/counting-methods/requirements.lock",
        "mirrors": []
      }
    },
    {
      "name": "reproduction/counting-methods/environment.json",
      "role": "environment",
      "bytes": 351,
      "sha256": "e672640da5e419a3e81522415d3e6aa267f41f77cdf0a449d88a36fb2559b4e6",
      "locations": {
        "canonical": "https://github.com/bc1cindy/decluster/raw/3b5e1762a28e4a8a7f869c41cf3785e158950a50/reproduction/counting-methods/environment.json",
        "mirrors": []
      }
    }
  ],
  "limitations": [
    "The bundled environment currently targets CPython 3.13 on macOS arm64.",
    "Public bootstrap remains unavailable until every blob has a canonical HTTPS location and an independent mirror."
  ]
}
