{
  "schema_version": 1,
  "id": "reid-v1",
  "capabilities": [
    "verify_outputs",
    "reproduce_runs"
  ],
  "runs": [
    "reid-v1"
  ],
  "blobs": [
    {
      "name": "catalog/runs/reid-v1.json",
      "role": "run_manifest",
      "bytes": 2949,
      "sha256": "d0bb9284deee60973f7a94da57ffec3c3147a6b5c7f1612d4a4ccec46ec25084",
      "locations": {
        "canonical": null,
        "mirrors": []
      }
    },
    {
      "name": "tests/fixtures/reid_sigs.json.gz",
      "role": "dataset",
      "bytes": 2051632,
      "sha256": "dbc4214fb499a96327326c4ea31341a76878c1867bfa3ccc57df88d850cdaa6a",
      "locations": {
        "canonical": "https://github.com/bc1cindy/decluster/raw/495874b5063bd83fc24e32eec1ebeb933471f6b9/tests/fixtures/reid_sigs.json.gz",
        "mirrors": []
      }
    },
    {
      "name": "results/artifacts/reid-v1.json",
      "role": "result",
      "bytes": 1504,
      "sha256": "9c4ac11aa3a1014907528b5ed8b324c0a9b1995a0d7a70f2c6963c49bc8e797f",
      "locations": {
        "canonical": null,
        "mirrors": []
      }
    },
    {
      "name": "results/generated/reid-v1.md",
      "role": "result",
      "bytes": 795,
      "sha256": "685acc5dc71a32295f04409c3e11b310934dbba6b44d4bd709255767f6b47c20",
      "locations": {
        "canonical": null,
        "mirrors": []
      }
    },
    {
      "name": "sources/decluster-59195e2-runtime.tar",
      "role": "source",
      "bytes": 2437120,
      "sha256": "8803bf1fe4950365bd5e07e582b087b2ad6bffef05bc869e294dd7e50fa6fb19",
      "locations": {
        "canonical": null,
        "mirrors": []
      }
    },
    {
      "name": "reproduction/reid/requirements.lock",
      "role": "lockfile",
      "bytes": 0,
      "sha256": "e3b0c44298fc1c149afbf4c8996fb92427ae41e4649b934ca495991b7852b855",
      "locations": {
        "canonical": null,
        "mirrors": []
      }
    },
    {
      "name": "reproduction/reid/environment.json",
      "role": "environment",
      "bytes": 344,
      "sha256": "28af8854e7bcd013dd1f4ab7a525c61c9e83652e3878512d5d2b3dc3b6d568b5",
      "locations": {
        "canonical": null,
        "mirrors": []
      }
    }
  ],
  "limitations": [
    "The bundled environment currently targets CPython 3.13 on macOS arm64.",
    "The dataset publisher authorized redistribution of the public fixture on 2026-09-04; upstream licensing remains undetermined.",
    "Public bootstrap remains incomplete until every blob has a canonical HTTPS location and an independent mirror."
  ]
}
