{
  "schema_version": 1,
  "id": "same-block-linkage-v1",
  "capabilities": [
    "verify_outputs",
    "reproduce_runs"
  ],
  "runs": [
    "same-block-linkage-v1"
  ],
  "blobs": [
    {
      "name": "catalog/runs/same-block-linkage-v1.json",
      "role": "run_manifest",
      "bytes": 3021,
      "sha256": "fb37775b4f15171fcb76db93a9e1a7b733a524f53c4638c71d404893584604b8",
      "locations": {
        "canonical": "https://github.com/bc1cindy/decluster/raw/3b5e1762a28e4a8a7f869c41cf3785e158950a50/catalog/runs/same-block-linkage-v1.json",
        "mirrors": []
      }
    },
    {
      "name": "data/boltzmann-fee-audit-v1.json",
      "role": "dataset",
      "bytes": 309025,
      "sha256": "17ee62e307d34660be2c4f50382a63ba044d0ad67f0674873e304d0b8203dc1c",
      "locations": {
        "canonical": "https://github.com/bc1cindy/decluster/raw/b797864acf974e329d27d394ced7bb96cabbbfd7/data/boltzmann-fee-audit-v1.json",
        "mirrors": []
      }
    },
    {
      "name": "results/artifacts/same-block-linkage-v1.json",
      "role": "result",
      "bytes": 1166,
      "sha256": "8f569aa3f08e4644bcba4f3cbfd48d4b2d52cafa9ecb4f455d730307700ad30e",
      "locations": {
        "canonical": "https://github.com/bc1cindy/decluster/raw/b797864acf974e329d27d394ced7bb96cabbbfd7/results/artifacts/same-block-linkage-v1.json",
        "mirrors": []
      }
    },
    {
      "name": "results/generated/same-block-linkage-v1.md",
      "role": "result",
      "bytes": 1438,
      "sha256": "7fa983fd3330dcf3c4c8d1d90b7284ae587cbb10f312683d18696e82096fa450",
      "locations": {
        "canonical": "https://github.com/bc1cindy/decluster/raw/b797864acf974e329d27d394ced7bb96cabbbfd7/results/generated/same-block-linkage-v1.md",
        "mirrors": []
      }
    },
    {
      "name": "sources/decluster-4844877-runtime.tar",
      "role": "source",
      "bytes": 2457600,
      "sha256": "18893f6a7cf35071c8065a531df466b391b971d690969e89a838de59ba250666",
      "locations": {
        "canonical": "https://github.com/bc1cindy/decluster/raw/3b5e1762a28e4a8a7f869c41cf3785e158950a50/sources/decluster-4844877-runtime.tar",
        "mirrors": []
      }
    },
    {
      "name": "reproduction/same-block-linkage/requirements.lock",
      "role": "lockfile",
      "bytes": 30,
      "sha256": "e0d6a8cada5d383c0aca2bd2a37f28c15721392469c94084128d369c29c5544d",
      "locations": {
        "canonical": "https://github.com/bc1cindy/decluster/raw/b797864acf974e329d27d394ced7bb96cabbbfd7/reproduction/same-block-linkage/requirements.lock",
        "mirrors": []
      }
    },
    {
      "name": "reproduction/same-block-linkage/environment.json",
      "role": "environment",
      "bytes": 372,
      "sha256": "c2525ac55e10de3250898e6d9afab8c07eb1293a2eccd0dea3d50820f3b5a4f5",
      "locations": {
        "canonical": "https://github.com/bc1cindy/decluster/raw/3b5e1762a28e4a8a7f869c41cf3785e158950a50/reproduction/same-block-linkage/environment.json",
        "mirrors": []
      }
    }
  ],
  "limitations": [
    "The bundled environment currently targets CPython 3.13 on macOS arm64.",
    "Public bootstrap remains unavailable until every blob has a canonical HTTPS location and an independent mirror.",
    "The bundle measures what the amounts settle inside the mapping family, not ownership."
  ]
}
