{
  "schema_version": 1,
  "id": "entity-deanon-v1",
  "capabilities": [
    "verify_outputs",
    "reproduce_runs"
  ],
  "runs": [
    "entity-deanon-v1"
  ],
  "blobs": [
    {
      "name": "catalog/runs/entity-deanon-v1.json",
      "role": "run_manifest",
      "bytes": 3453,
      "sha256": "6580cdb6a932c98da025b4f7d91afe26f2d425836741b4160462bf4748bdb4ea",
      "locations": {
        "canonical": null,
        "mirrors": []
      }
    },
    {
      "name": "tests/fixtures/entity_satoshidice_2013.ndjson.gz",
      "role": "dataset",
      "bytes": 1315051,
      "sha256": "6cac465a5eca59633fbb3e6f99b83146b9b0e590adf95801a303ccd815699846",
      "locations": {
        "canonical": "https://github.com/bc1cindy/decluster/raw/554e72131df9b28aa2a90b09184a159a841d3077/tests/fixtures/entity_satoshidice_2013.ndjson.gz",
        "mirrors": []
      }
    },
    {
      "name": "tests/fixtures/entity_bitmex_2019.ndjson.gz",
      "role": "dataset",
      "bytes": 2523417,
      "sha256": "699c87235bce17a43a8befe2c412dd7bea61ffe3dd772abe7addcbae5a4b8ea8",
      "locations": {
        "canonical": "https://github.com/bc1cindy/decluster/raw/678ecb5fa4681679c378d8adef7bd1c4f2800f37/tests/fixtures/entity_bitmex_2019.ndjson.gz",
        "mirrors": []
      }
    },
    {
      "name": "results/artifacts/entity-deanon-v1.json",
      "role": "result",
      "bytes": 1100,
      "sha256": "4825de7e64906f0d708bdcbd3bd23836675ff168166c5ff06fc0ea25d95afb38",
      "locations": {
        "canonical": null,
        "mirrors": []
      }
    },
    {
      "name": "results/generated/entity-deanon-v1.md",
      "role": "result",
      "bytes": 557,
      "sha256": "9a3fdc6c79bc5c94cc687b5a41ebff8c663ecf3358cb080883e93cd30d94d850",
      "locations": {
        "canonical": null,
        "mirrors": []
      }
    },
    {
      "name": "sources/decluster-f9e1411-runtime.tar",
      "role": "source",
      "bytes": 2201600,
      "sha256": "0b649571b875e0a67151c8b3e201650e29a6c36daa1c2a5116bc23b27c968824",
      "locations": {
        "canonical": null,
        "mirrors": []
      }
    },
    {
      "name": "reproduction/entity-deanon/requirements.lock",
      "role": "lockfile",
      "bytes": 0,
      "sha256": "e3b0c44298fc1c149afbf4c8996fb92427ae41e4649b934ca495991b7852b855",
      "locations": {
        "canonical": null,
        "mirrors": []
      }
    },
    {
      "name": "reproduction/entity-deanon/environment.json",
      "role": "environment",
      "bytes": 362,
      "sha256": "dd51c702b0fee1f39e9584c7fed727056a5903de1a053d42da947dbbc15cb533",
      "locations": {
        "canonical": null,
        "mirrors": []
      }
    }
  ],
  "limitations": [
    "The bundled environment currently targets CPython 3.13 on macOS arm64.",
    "The dataset publisher authorized redistribution of both public fixtures on 2026-09-04; upstream licensing remains undetermined.",
    "Public bootstrap remains incomplete until every blob has a canonical HTTPS location and an independent mirror."
  ]
}
