{
  "schema_version": 1,
  "id": "scorer-families-v1",
  "capabilities": [
    "verify_outputs",
    "reproduce_runs"
  ],
  "runs": [
    "scorer-families-v1"
  ],
  "blobs": [
    {
      "name": "catalog/runs/scorer-families-v1.json",
      "role": "run_manifest",
      "bytes": 2986,
      "sha256": "3bea2859b366215abf99a8d4ecea8afacc6edc612d721ecd1918f1b0c0df4fe9",
      "locations": {
        "canonical": null,
        "mirrors": []
      }
    },
    {
      "name": "results/artifacts/scorer-families-v1.json",
      "role": "result",
      "bytes": 1698,
      "sha256": "473b7a0f83805809411d4691f18103fbb74f0587a3a5b6988b776da46f43ea25",
      "locations": {
        "canonical": null,
        "mirrors": []
      }
    },
    {
      "name": "results/generated/scorer-families-v1.md",
      "role": "result",
      "bytes": 1257,
      "sha256": "eb1bd191d66405751de2e39fe90e3c80c4a4c7d4a993440ea6e82ec6d0389654",
      "locations": {
        "canonical": null,
        "mirrors": []
      }
    },
    {
      "name": "data/fs-blkcache-2026-09-04.tar.gz",
      "role": "dataset",
      "bytes": 33352455,
      "sha256": "5a69f6f446dbdfcce09dddc91c653e5d841124d14020b720fdea276315c775a6",
      "locations": {
        "canonical": null,
        "mirrors": []
      }
    },
    {
      "name": "sources/decluster-4de0107-runtime.tar",
      "role": "source",
      "bytes": 2170880,
      "sha256": "1f05c5d37a16840f7385a82610d70a916b3f7704075c5b71764a6389c3ba3f71",
      "locations": {
        "canonical": null,
        "mirrors": []
      }
    },
    {
      "name": "reproduction/scorer-families/requirements.lock",
      "role": "lockfile",
      "bytes": 0,
      "sha256": "e3b0c44298fc1c149afbf4c8996fb92427ae41e4649b934ca495991b7852b855",
      "locations": {
        "canonical": null,
        "mirrors": []
      }
    },
    {
      "name": "reproduction/scorer-families/environment.json",
      "role": "environment",
      "bytes": 366,
      "sha256": "01371ea4782a9723534294023e65a69d7b8b59f693d5ae60af446edd575c9101",
      "locations": {
        "canonical": null,
        "mirrors": []
      }
    }
  ],
  "limitations": [
    "The bundled environment currently targets CPython 3.13 on macOS arm64.",
    "The public on-chain snapshot is redistributed with provider authorization.",
    "The historical 165,832-transaction cache is unavailable and is not reproduced.",
    "Public bootstrap remains incomplete until every blob has a canonical HTTPS location and an independent mirror."
  ]
}
