{
  "schema_version": 1,
  "id": "fingerprint-regime-v1",
  "capabilities": [
    "verify_outputs",
    "reproduce_runs"
  ],
  "runs": [
    "fingerprint-regime-v1"
  ],
  "blobs": [
    {
      "name": "catalog/runs/fingerprint-regime-v1.json",
      "role": "run_manifest",
      "bytes": 3160,
      "sha256": "a45d50357be2b6db0e183999841a4df153d370b8add40828ccdca9a1d51202c1",
      "locations": {
        "canonical": null,
        "mirrors": []
      }
    },
    {
      "name": "tests/fixtures/fingerprint_blkcache_sample.json",
      "role": "dataset",
      "bytes": 1701974,
      "sha256": "406ce2d7d0a04f7c73281bce6b6a781012a8765e079693f010a0154e926c6a6c",
      "locations": {
        "canonical": "https://github.com/bc1cindy/decluster/raw/2f1bbae5ac4923ff7b799b25be0dd66b4ec3f692/tests/fixtures/fingerprint_blkcache_sample.json",
        "mirrors": []
      }
    },
    {
      "name": "results/artifacts/fingerprint-regime-v1.json",
      "role": "result",
      "bytes": 1290,
      "sha256": "6569cd89853bd99678a8de4153b3a01d0a8d7a61b7ab718b2a0fba015537d863",
      "locations": {
        "canonical": null,
        "mirrors": []
      }
    },
    {
      "name": "results/generated/fingerprint-regime-v1.md",
      "role": "result",
      "bytes": 774,
      "sha256": "271fa7e6601871b7fad9ac6e50b23a5f164d4a0ca30bc88c7629828b4858789b",
      "locations": {
        "canonical": null,
        "mirrors": []
      }
    },
    {
      "name": "sources/decluster-4382c4c-runtime.tar",
      "role": "source",
      "bytes": 2293760,
      "sha256": "d2ed01e376420fcbbaa258af9c4d19ab8e43a46663ba858efe720586481f71fa",
      "locations": {
        "canonical": null,
        "mirrors": []
      }
    },
    {
      "name": "reproduction/fingerprint-regime/requirements.lock",
      "role": "lockfile",
      "bytes": 0,
      "sha256": "e3b0c44298fc1c149afbf4c8996fb92427ae41e4649b934ca495991b7852b855",
      "locations": {
        "canonical": null,
        "mirrors": []
      }
    },
    {
      "name": "reproduction/fingerprint-regime/environment.json",
      "role": "environment",
      "bytes": 372,
      "sha256": "6cb34b48d6bbd9f2bbc55794bfc276ca397e0e5311fd2d6ee260ec61464b198f",
      "locations": {
        "canonical": null,
        "mirrors": []
      }
    }
  ],
  "limitations": [
    "The bundled environment currently targets CPython 3.13 on macOS arm64.",
    "The dataset publisher authorized redistribution of the public fixture on 2026-09-04; upstream licensing remains undetermined.",
    "Public bootstrap remains incomplete until every blob has a canonical HTTPS location and an independent mirror."
  ]
}
